{
  "$schema": "https://json-schema.org/draft/2020-12/schema",
  "$id": "https://github.com/Azure/git-ape/schemas/git-ape/security-gate/v1.json",
  "title": "Git-Ape security-gate.json (v1)",
  "description": "Result of the security analysis gate run before deployment. v1.0 adopts the count form (criticalTotal/criticalPassed/highTotal/highPassed as integers). The legacy boolean form (criticalPassed: true) is rejected — migrate corpus before validating.",
  "type": "object",
  "additionalProperties": false,
  "required": [
    "schemaVersion",
    "gate",
    "iterations",
    "criticalTotal",
    "criticalPassed",
    "highTotal",
    "highPassed",
    "blockingFindings",
    "generatedAt"
  ],
  "properties": {
    "$schema": { "type": "string" },
    "schemaVersion": { "const": "1.0" },
    "gate": {
      "type": "string",
      "enum": ["PASSED", "BLOCKED", "OVERRIDDEN"]
    },
    "iterations": {
      "type": "integer",
      "minimum": 1,
      "description": "Number of times the security gate ran (re-runs after fixes increment this)."
    },
    "criticalTotal": {
      "type": "integer",
      "minimum": 0,
      "description": "Number of Critical-severity checks evaluated."
    },
    "criticalPassed": {
      "type": "integer",
      "minimum": 0,
      "description": "Number of Critical-severity checks that passed. MUST be <= criticalTotal."
    },
    "highTotal": {
      "type": "integer",
      "minimum": 0
    },
    "highPassed": {
      "type": "integer",
      "minimum": 0,
      "description": "MUST be <= highTotal."
    },
    "mediumTotal": {
      "type": "integer",
      "minimum": 0
    },
    "mediumPassed": {
      "type": "integer",
      "minimum": 0
    },
    "lowTotal": {
      "type": "integer",
      "minimum": 0
    },
    "lowPassed": {
      "type": "integer",
      "minimum": 0
    },
    "blockingFindings": {
      "type": "array",
      "description": "List of finding IDs that prevented gate from passing (only relevant when gate != PASSED).",
      "items": {
        "oneOf": [
          { "type": "string", "minLength": 1 },
          {
            "type": "object",
            "required": ["id", "severity"],
            "properties": {
              "id": { "type": "string" },
              "severity": {
                "type": "string",
                "enum": ["Critical", "High", "Medium", "Low", "Informational"]
              },
              "title": { "type": "string" },
              "resource": { "type": "string" },
              "remediation": { "type": "string" }
            }
          }
        ]
      }
    },
    "overrideReason": {
      "type": ["string", "null"],
      "description": "Required when gate=OVERRIDDEN. MUST be null otherwise."
    },
    "overriddenBy": {
      "type": ["string", "null"]
    },
    "generatedAt": {
      "type": "string",
      "format": "date-time"
    },
    "deploymentId": {
      "type": "string",
      "pattern": "^[a-z0-9][a-z0-9._-]{0,89}$"
    }
  },
  "allOf": [
    {
      "description": "Counts must not exceed totals.",
      "if": { "required": ["criticalTotal", "criticalPassed"] },
      "then": {
        "properties": {
          "criticalPassed": { "type": "integer" }
        }
      }
    }
  ]
}
